,LA,22,22_harrison_2011,10.1029/2009WR008926,"Channel dynamics and habitat development in a meandering, gravel bed river",Chinook salmon,"spawning, rearing","Merced River, California","N/A - cover not treated directly; instead, it's discussed implicitly in point bars, channel margins, and (absence of) undercut banks; riparian vegetation and woody cover appear absent at the site","N/A - cover not meaningfully defined or quantified; cover is framed as an emergent property of geomorphic and hydraulic processes, not a categorical habitat feature","not directly measured for rearing - habitat is assessed via modeled depth and velocity fields, HSIs, and flow-complexity metrics; spawning HSI evaluated against mapped redds",N/A - not evaluated,"velocity, depth, velocity gradients/flow complexity, channel morphology (pools, bars, constrictions)",no,1a,
,LA,26,26_barber_2018,10.2495/EI-V1-N3-390-400,Uncertainty in minimum instream flow requirements for streams in semi-arid environments,"""anadromous and endangered fish species"" - salmon (species not specified), steelhead, bull trout","spawning, rearing, holding","Touchet River, southeastern Washington","substrate; undercut bank, overhanging vegetation, root wad, log jam/submerged brush pile, logs parallel to bank, aquatic vegetation, short terrestrial grass, tall terrestrial grass, vegetation beyond the bankfull water edge",N/A,"measurements at redds and visual surveys of rearing and holding (but this isn't really specified, as it is not core to the paper's thesis)","cover influence is specified as a cover presence value in the range [0, 1] for each life stage",N/A,yes - nice table of cover preference values,1b,
,LA,38,38_ibbotson_1994,10.1111/j.1365-2400.1994.tb00157.x,Spatial and temporal distribution of fish in a small lowland stream,"brown trout, Atlantic salmon, grayling, dace, roach, pike, eel",unclear,"East Stoke Millstream (River Frome), England",substrate,"visual assessment of substrate size category, percent instream cover, percent outstream cover (each site sampled 8 times over the course of the study)",electrofishing  to determine number of fish present,no significant relationship between substrate size and salmon or instream or outstream cover percentage and salmon; significant positive correlation between trout and outstream cover percentage and substrate size,"salmon and trout presence negatively correlated with depth and positively correlated with velocity and width-to-depth ratio; trout positively correlated with trout and outstream cover percentage and substrate size; notably, fish presence (i.e., local abundance) at a site varied widely over short time periods (<1 month)",yes - it actually quantifies cover,3a,
,LA,39,39_bair_2019,10.5194/esurf-7-841-2019,Quantifying the restoration success of wood introductions to increase coho salmon winter habitat,coho salmon,rearing,"Mill Creek, Oregon","large wood, substrate (not really cover?)","large wood length and diameter (then used to model local water velocities and resulting area of suitable fish habitat), substrate D50",N/A,N/A,N/A,yes - interesting discussion of the impacts of large wood on velocities and microhabitat availability,"2b, 3b",
,LA,42,42_chalmers_2023e,10.1371/journal.pwat.0000069,Application of watershed-scale habitat modeling and decision-support tools for reservoir reoperations in coastal northern California,"Chinook salmon, steelhead trout","immigration, spawning, incubation, fry rearing, juvenile rearing, emigration","Three Creeks watershed, South Bay, California","large cobble, medium cobble, boulder, root mass, large woody debris, bedrock ledges, undercut bank","areal percent cover, areal percent substrate embeddedness, areal percent suitable substrate from field surveys at 39 points of interest",N/A,N/A,N/A,not sure - cover is only addressed as an input to a multi-objective optimization model for water supply management decisions,1b,
,LA,43,43_tullos_2014,10.1007/s10641-014-0362-4,"Fish use of turbulence around wood in winter: physical experiments on hydraulic variability and habitat selection by juvenile coho salmon, Oncorhynchus kisutch",coho salmon,rearing,"experimental channels, Oregon",large wood,large wood length and diameter (though this was not the variable of interest; water velocities and their local variability/turbulence was the main variable of interest),"videogrammetry to capture fish locations and movement patterns in the experimental channel, then comparison of the observed distribution of fish across different hydraulic habitat conditions to a null model based on their availability, using a chi-square goodness of fit test to assess whether fish select habitats in proportion to their availability",N/A,"""the observed available distributions suggested that, during winter conditions and without foraging opportunities, fish selected areas of greater depth, low velocities, and low but not minimum turbulence intensity and flow field deformation, and close to wood""",yes - interesting discussion of the impacts of large wood on velocities and microhabitat availability,3a,
,LA,44,44_conallin_2014,10.1051/kmae/2014006,Daytime habitat selection for juvenile parr brown trout (Salmo trutta) in small lowland streams,brown trout,spawning,Denmark,"""solid cover"" (boulders, wood and log jams, undercut banks), ""reduced visibility cover"" (water surface tension), ""no cover""","""Substrate composition and cover was visually assessedwithin a 0.25 m x 0.25 m square. S-values were registered according to a modified Wentworth scale with assessment of the relative proportion of each of the categories: boulder (diameter(Ř) > 256 mm), cobble (Ř = 64–256 mm), pebble (Ř = 16–63 mm), gravel (Ř = 2?15 mm),sand (Ř = 0.06–1 mm), and silt (Ř < 0.06 mm). Cover (C) was registered as present or absent according to three main categories; solid cover (i.e. boulder, wood and log jams, undercut bank) (SOL), reduced visibility cover (water surface tension)(REV), and no cover (NC)""",electrofishing  to determine locations of fish,parr show a preference for coarser substrates and solid cover,"water depth was found to be the most significant variable for daytime habitat selection, with cover and substrate also being important",yes? the article is an explicit habitat suitability study that quantifies and establishes the importance of cover as a habitat selection variable,3a,
,LA,48,48_mclaren_2024,10.1007/s10750-024-05671-7,The reach-scale biogeomorphic effect of submerged macrophytes on trout habitat suitability,rainbow trout,"subadult (young-of-year excluded), adult","Snake River, Idaho","submerged macrophytes, emergent margins, substrate (not really cover?)","percent coverage of submerged macrophytes, macrophyte growth height as absolute and as a percentage of maximum depth","snorkel surveys, radio telemetry data, visual wading surveys; habitat preference was quantified using the Chesson’s alpha electivity index","higher macrophyte coverage created distinct habitat types (e.g., macrophyte clumps) that had higher Net Rate of Energy Intake (NREI) (indicating enhanced growth potential) by reducing flow velocities and increasing invertebrate drift","habitat dynamics are primarily driven by submerged macrophyte coverage acting as a ""biogeomorphic"" force; the quality of drift-feeding habitat (NREI) is determined by the balance between energy gain (invertebrate drift density, food availability) and energetic costs (metabolism, foraging, and maintaining position in current/velocity)",yes - the article investigates the habitat suitability and quantified preference of fish in relation to a specific type of cover (submerged macrophytes),3a,
,LA,56,56_boudreault_2022,10.1016/j.ecolmodel.2022.109905,A new look at habitat suitability curves through functional data analysis,Atlantic salmon,rearing,"Sainte-Marguerite River and Petite-Cascapedia River, Quebec",substrate,substrate D50,single-pass open net electrofishing surveys in habitat patches where fish were observed,N/A,N/A,yes? narrative review content is helpful (much discussion of models),1a,
